{
  "$schema": "./schema/registry.schema.json",
  "schemaVersion": "1.0.0",
  "registry": {
    "name": "Signaliks OID Registry",
    "rootOid": "1.3.6.1.4.1.65553",
    "pen": 65553,
    "canonicalBaseUrl": "https://oid.iks.moe",
    "governingPolicyRef": "POL-ROOT-2.0.0"
  },
  "authorities": [
    {
      "id": "iana-pen-ra",
      "name": "Internet Assigned Numbers Authority",
      "type": "external-registration-authority",
      "contactUri": "https://www.iana.org/assignments/enterprise-numbers"
    },
    {
      "id": "signaliks-root-ra",
      "name": "Signaliks",
      "type": "root-registration-authority",
      "contactRole": "Signaliks OID Registration Authority",
      "contactEmail": "contact@iks.moe"
    },
    {
      "id": "youngdo-pki-ra",
      "name": "Youngdo Technologies Limited",
      "type": "delegated-registration-authority",
      "contactRole": "Youngdo PKI Registration Authority",
      "contactEmail": "pki@youngdo.net"
    }
  ],
  "policies": [
    {
      "id": "POL-ROOT-1.0.1",
      "family": "root-registry-policy",
      "revision": "1.0.1",
      "status": "superseded",
      "publishedAt": "2026-04-15T00:00:00+08:00",
      "effectiveAt": "2026-04-15T00:00:00+08:00",
      "supersededBy": "POL-ROOT-2.0.0",
      "sourceCommit": "a53a12de6faa7b0db10dacf8cc26ed28028ed9bc",
      "sha256": "bec3ec0f310f12a355edf74ed9283c874b3b49d95769e6702f8cc59e541c8207"
    },
    {
      "id": "POL-ROOT-2.0.0",
      "family": "root-registry-policy",
      "revision": "2.0.0",
      "status": "effective",
      "publishedAt": "2026-09-10T00:00:00+08:00",
      "effectiveAt": "2026-09-10T00:00:00+08:00",
      "documentRoute": "/1.3.6.1.4.1.65553/0/",
      "supersedes": "POL-ROOT-1.0.1"
    },
    {
      "id": "POL-PKI-1.0.0",
      "family": "pki-arc-policy",
      "revision": "1.0.0",
      "status": "superseded",
      "publishedAt": "2026-04-16T00:00:00+08:00",
      "effectiveAt": "2026-04-16T00:00:00+08:00",
      "supersededBy": "POL-PKI-2.0.0",
      "sourceCommit": "a53a12de6faa7b0db10dacf8cc26ed28028ed9bc",
      "sha256": "e7135f6de5043e54a1fede4e624371c81ca7613c92365500663085aa3a7d3a28"
    },
    {
      "id": "POL-PKI-2.0.0",
      "family": "pki-arc-policy",
      "revision": "2.0.0",
      "status": "effective",
      "publishedAt": "2026-09-10T00:00:00+08:00",
      "effectiveAt": "2026-09-10T00:00:00+08:00",
      "documentRoute": "/1.3.6.1.4.1.65553/2/0/",
      "supersedes": "POL-PKI-1.0.0"
    },
    {
      "id": "POL-TA-1.0.0",
      "family": "trust-anchor-arc-policy",
      "revision": "1.0.0",
      "status": "superseded",
      "publishedAt": "2026-04-16T00:00:00+08:00",
      "effectiveAt": "2026-04-16T00:00:00+08:00",
      "supersededBy": "POL-TA-2.0.0",
      "sourceCommit": "a53a12de6faa7b0db10dacf8cc26ed28028ed9bc",
      "sha256": "1efef6723dd8afe7eab414deecd1ebc26663c7e584c31968659522f136ce7c8a"
    },
    {
      "id": "POL-TA-2.0.0",
      "family": "trust-anchor-arc-policy",
      "revision": "2.0.0",
      "status": "effective",
      "publishedAt": "2026-09-10T00:00:00+08:00",
      "effectiveAt": "2026-09-10T00:00:00+08:00",
      "documentRoute": "/1.3.6.1.4.1.65553/2/2/0/",
      "supersedes": "POL-TA-1.0.0"
    },
    {
      "id": "POL-MANAGED-TRUST-1.0.0",
      "family": "managed-trust-certificate-policies",
      "revision": "1.0.0",
      "status": "effective",
      "publishedAt": "2026-10-15T10:23:16+08:00",
      "effectiveAt": "2026-10-15T10:23:16+08:00",
      "documentRoute": "/1.3.6.1.4.1.65553/2/1/10/policy/"
    }
  ],
  "delegations": [
    {
      "id": "DLG-2026-0001",
      "arc": "1.3.6.1.4.1.65553.2",
      "delegatorRef": "signaliks-root-ra",
      "delegateRef": "youngdo-pki-ra",
      "status": "active",
      "effectiveAt": "2026-04-16T00:00:00+08:00",
      "ratifiedAt": "2026-09-10T00:00:00+08:00",
      "governingPolicyRef": "POL-ROOT-2.0.0",
      "decisionRef": "DLG-2026-0001-DECISION",
      "permissions": [
        "allocate-immediate-nodes",
        "allocate-sub-arcs",
        "adopt-subordinate-policies",
        "publish-registration-records"
      ],
      "subdelegationAllowed": false,
      "instrumentPath": "registry/instruments/DLG-2026-0001.md"
    }
  ],
  "decisions": [
    {
      "id": "IANA-PEN-65553",
      "type": "external-assignment",
      "status": "recorded",
      "decidedAt": null,
      "recordedAt": "2026-09-10T00:00:00+08:00",
      "authorityRef": "iana-pen-ra",
      "policyRef": null,
      "affectedOids": [
        "1.3.6.1.4.1.65553"
      ],
      "approvals": [],
      "publicRationale": "PEN 65553 is recorded in the IANA Private Enterprise Numbers registry."
    },
    {
      "id": "MIG-2026-0001",
      "type": "legacy-import",
      "status": "approved",
      "decidedAt": "2026-09-10T00:00:00+08:00",
      "recordedAt": "2026-09-10T00:00:00+08:00",
      "authorityRef": "signaliks-root-ra",
      "policyRef": "POL-ROOT-2.0.0",
      "affectedOids": [
        "1.3.6.1.4.1.65553.0",
        "1.3.6.1.4.1.65553.1",
        "1.3.6.1.4.1.65553.2",
        "1.3.6.1.4.1.65553.3",
        "1.3.6.1.4.1.65553.4",
        "1.3.6.1.4.1.65553.2.0",
        "1.3.6.1.4.1.65553.2.1",
        "1.3.6.1.4.1.65553.2.2",
        "1.3.6.1.4.1.65553.2.3",
        "1.3.6.1.4.1.65553.2.4",
        "1.3.6.1.4.1.65553.2.2.0",
        "1.3.6.1.4.1.65553.2.2.1",
        "1.3.6.1.4.1.65553.2.2.2",
        "1.3.6.1.4.1.65553.2.2.3",
        "1.3.6.1.4.1.65553.2.2.4",
        "1.3.6.1.4.1.65553.2.2.5",
        "1.3.6.1.4.1.65553.2.2.6",
        "1.3.6.1.4.1.65553.2.2.7",
        "1.3.6.1.4.1.65553.2.2.8",
        "1.3.6.1.4.1.65553.2.2.9",
        "1.3.6.1.4.1.65553.2.2.10",
        "1.3.6.1.4.1.65553.2.2.11",
        "1.3.6.1.4.1.65553.2.2.12",
        "1.3.6.1.4.1.65553.2.2.13"
      ],
      "approvals": [
        {
          "authorityRef": "signaliks-root-ra",
          "role": "root-registration-authority",
          "approvedAt": "2026-09-10T00:00:00+08:00"
        },
        {
          "authorityRef": "youngdo-pki-ra",
          "role": "delegated-registration-authority",
          "approvedAt": "2026-09-10T00:00:00+08:00"
        }
      ],
      "publicRationale": "Records already published before the structured registry was introduced were imported without changing their numeric OIDs or asserting unrecorded historical facts."
    },
    {
      "id": "POL-2026-0001",
      "type": "policy-adoption",
      "status": "approved",
      "decidedAt": "2026-09-10T00:00:00+08:00",
      "recordedAt": "2026-09-10T00:00:00+08:00",
      "authorityRef": "signaliks-root-ra",
      "policyRef": "POL-ROOT-2.0.0",
      "affectedOids": [
        "1.3.6.1.4.1.65553.0",
        "1.3.6.1.4.1.65553.2.0",
        "1.3.6.1.4.1.65553.2.2.0"
      ],
      "approvals": [
        {
          "authorityRef": "signaliks-root-ra",
          "role": "root-policy-authority",
          "approvedAt": "2026-09-10T00:00:00+08:00"
        },
        {
          "authorityRef": "youngdo-pki-ra",
          "role": "delegated-policy-authority",
          "approvedAt": "2026-09-10T00:00:00+08:00"
        }
      ],
      "publicRationale": "Adopts the structured registry, immutable allocation records, explicit delegation records, and separate object lifecycle states."
    },
    {
      "id": "DLG-2026-0001-DECISION",
      "type": "delegation-ratification",
      "status": "approved",
      "decidedAt": "2026-09-10T00:00:00+08:00",
      "recordedAt": "2026-09-10T00:00:00+08:00",
      "authorityRef": "signaliks-root-ra",
      "policyRef": "POL-ROOT-2.0.0",
      "affectedOids": [
        "1.3.6.1.4.1.65553.2"
      ],
      "approvals": [
        {
          "authorityRef": "signaliks-root-ra",
          "role": "delegator",
          "approvedAt": "2026-09-10T00:00:00+08:00"
        },
        {
          "authorityRef": "youngdo-pki-ra",
          "role": "delegate",
          "approvedAt": "2026-09-10T00:00:00+08:00"
        }
      ],
      "publicRationale": "Ratifies the existing PKI arc delegation as an explicit, machine-readable administrative instrument."
    },
    {
      "id": "ALLOC-2026-0001",
      "type": "allocation",
      "status": "approved",
      "decidedAt": "2026-09-10T00:00:00+08:00",
      "recordedAt": "2026-09-10T00:00:00+08:00",
      "authorityRef": "youngdo-pki-ra",
      "policyRef": "POL-PKI-2.0.0",
      "affectedOids": [
        "1.3.6.1.4.1.65553.2.5"
      ],
      "approvals": [
        {
          "authorityRef": "youngdo-pki-ra",
          "role": "delegated-registration-authority",
          "approvedAt": "2026-09-10T00:00:00+08:00"
        },
        {
          "authorityRef": "signaliks-root-ra",
          "role": "independent-reviewer",
          "approvedAt": "2026-09-10T00:00:00+08:00"
        }
      ],
      "publicRationale": "Allocates a distinct arc for immutable, versioned trust-anchor groups."
    },
    {
      "id": "POL-2026-1015-MANAGED-TRUST",
      "type": "policy-adoption",
      "status": "approved",
      "decidedAt": "2026-10-15T10:23:16+08:00",
      "recordedAt": "2026-10-15T10:23:16+08:00",
      "authorityRef": "youngdo-pki-ra",
      "policyRef": "POL-PKI-2.0.0",
      "affectedOids": [
        "1.3.6.1.4.1.65553.2.1.10",
        "1.3.6.1.4.1.65553.2.1.10.1",
        "1.3.6.1.4.1.65553.2.1.10.2",
        "1.3.6.1.4.1.65553.2.1.10.3",
        "1.3.6.1.4.1.65553.2.1.10.4",
        "1.3.6.1.4.1.65553.2.1.10.5",
        "1.3.6.1.4.1.65553.2.1.10.6",
        "1.3.6.1.4.1.65553.2.1.10.7",
        "1.3.6.1.4.1.65553.2.1.10.8",
        "1.3.6.1.4.1.65553.2.1.10.9",
        "1.3.6.1.4.1.65553.2.1.10.11"
      ],
      "approvals": [
        {
          "authorityRef": "youngdo-pki-ra",
          "role": "delegated-registration-and-policy-authority",
          "approvedAt": "2026-10-15T10:23:16+08:00"
        }
      ],